{
  "adapter": {
    "skeleton": "contract-only"
  },
  "documentation": {
    "proven_support": [],
    "status": "scaffold"
  },
  "license": {
    "source": "LICENSE",
    "spdx_id": "GPL-3.0-only"
  },
  "nxextract_recipe": "ports/titansouls/extractor.json",
  "nxport": {
    "architecture": "armv7",
    "argument_mode": "none",
    "enabled_quirks": [],
    "executable": "titansouls-nextos",
    "home_mode": "port",
    "id": "titansouls",
    "launcher_name": "Titan Souls.sh",
    "nxextract": {
      "mode": "yes",
      "version": "1.2.12"
    },
    "prepare_script": "",
    "private_library_paths": [],
    "required_capabilities": [
      "host.portmaster",
      "host.armhf-libs",
      "graphics.window",
      "graphics.gles2",
      "graphics.egl",
      "graphics.egl-config",
      "graphics.drawable",
      "audio.output-open",
      "input.controller-mapping",
      "input.controller-api"
    ],
    "required_files": [
      "titansouls-nextos",
      "lib/libTestSuite.so",
      "lib/libfmodex.so",
      "assets/config.txt",
      "sdcard/Android/obb/com.devolver.titansouls/main.31.com.devolver.titansouls.obb"
    ],
    "runtime_report": "log",
    "schema_version": 2,
    "title": "Titan Souls"
  },
  "portmaster": {
    "metadata_version": 4,
    "min_glibc": "2.28"
  },
  "schema_version": 1
}
