{
  "adapter": {
    "skeleton": "contract-only"
  },
  "documentation": {
    "proven_support": [],
    "status": "scaffold"
  },
  "license": {
    "source": "LICENSE",
    "spdx_id": "GPL-3.0-only"
  },
  "nxextract_recipe": "ports/bbracing2/extractor.json",
  "nxport": {
    "architecture": "aarch64",
    "argument_mode": "none",
    "enabled_quirks": [],
    "executable": "bbracing2",
    "home_mode": "port",
    "id": "bbracing2",
    "launcher_name": "Beach Buggy Racing 2.sh",
    "nxextract": {
      "mode": "yes",
      "version": "1.2.18"
    },
    "prepare_script": "",
    "private_library_paths": [
      "lib"
    ],
    "required_capabilities": [
      "host.portmaster",
      "graphics.window",
      "graphics.egl",
      "graphics.egl-config",
      "graphics.drawable",
      "audio.output-open",
      "input.controller-mapping",
      "input.controller-api",
      "graphics.gles2"
    ],
    "required_files": [
      "bbracing2",
      "nxsplash-nextos",
      "lib/libSDL3.so.0",
      "gamedata/lib/arm64-v8a/libmain.so",
      "gamedata/assets/Assets.apf"
    ],
    "runtime_report": "log",
    "schema_version": 2,
    "title": "Beach Buggy Racing 2"
  },
  "portmaster": {
    "metadata_version": 4,
    "min_glibc": "2.27"
  },
  "schema_version": 1
}